{
  "schema": "artifact.patch.v1",
  "artifact_id": "art_img_001",
  "base_version": 1,
  "ops": [
    {
      "op": "add",
      "path": "/props/annotations/-",
      "value": {
        "id": "ann_001",
        "type": "box",
        "region": {
          "type": "box",
          "coordinate_system": "normalized",
          "x1": 0.32,
          "y1": 0.21,
          "x2": 0.58,
          "y2": 0.43
        },
        "text": "这里太暗，请提亮，但不要改变人物表情。",
        "status": "pending"
      }
    }
  ]
}
